{
  "formatId": "idea-proposal.default",
  "skeletonVersion": "v1",
  "projectId": "proj_phase1_swallowing_disorder",
  "note": "Real private content transcribed from the user's own uploaded Phase 1 reference document (Phiếu trình ý tưởng đề tài nghiên cứu — rối loạn nuốt sau đột quỵ). Kept entirely outside /formats; merged into formats/idea-proposal/default/document-skeleton.json at export time by format-registry/answers-merge.ts.",
  "answers": {
    "studentName": "Nguyễn Văn A",
    "trainingLevel": "Chuyên khoa cấp I",
    "specialty": "Phục hồi chức năng",
    "institution": "Bệnh viện Phục hồi chức năng tỉnh X",
    "expectedSupervisor": "……………………………………………",
    "submissionDate": "02/08/2026",
    "studyTitle": "Đặc điểm rối loạn nuốt và một số yếu tố liên quan ở người bệnh đột quỵ não giai đoạn bán cấp tại Bệnh viện Phục hồi chức năng tỉnh X năm 2026",
    "objectives": "Mục tiêu 1. Mô tả đặc điểm rối loạn nuốt ở người bệnh đột quỵ não giai đoạn bán cấp tại Bệnh viện Phục hồi chức năng tỉnh X năm 2026.\nMục tiêu 2. Phân tích một số yếu tố liên quan đến mức độ rối loạn nuốt ở nhóm đối tượng nghiên cứu trên.",
    "rationale": "Rối loạn nuốt là biến chứng thường gặp sau đột quỵ não và liên quan trực tiếp đến viêm phổi hít, suy dinh dưỡng và kéo dài thời gian nằm viện. Tại đơn vị, việc phát hiện rối loạn nuốt hiện chủ yếu dựa vào quan sát của điều dưỡng, chưa có sàng lọc hệ thống, nên chưa xác định được tỷ lệ thực tế cũng như nhóm người bệnh nguy cơ cao. Thang GUSS đã có bản dịch tiếng Việt và đang được sử dụng tại khoa, do đó nghiên cứu không phát sinh chi phí công cụ đo lường. Kết quả dự kiến giúp xây dựng quy trình sàng lọc nuốt thường quy cho người bệnh đột quỵ tại đơn vị.",
    "designValue": "Mô tả cắt ngang",
    "subjectsValue": "Người bệnh đột quỵ não giai đoạn bán cấp điều trị nội trú",
    "inclusionCriteria": "Chẩn đoán xác định đột quỵ não; trong vòng 7 ngày đến 6 tháng từ khi khởi phát; đồng ý tham gia",
    "exclusionCriteria": "Rối loạn ý thức không hợp tác được; có bệnh lý hầu họng từ trước",
    "measurementTool": "Thang GUSS (bản tiếng Việt); bệnh án nghiên cứu",
    "collectionPeriod": "8 tháng, dự kiến từ tháng 9/2026",
    "sampleSizeFeasibility": "Cỡ mẫu cần theo công thức: 96 (ước lượng một tỷ lệ, p = 0,5; d = 0,10). Số ca ước tính mỗi tháng: 25 (học viên khai báo). Số tháng thu thập: 8. Tỷ lệ đủ tiêu chuẩn chọn (giả định): 60% (mặc định hệ thống). Tỷ lệ đồng ý tham gia (giả định): 85% (mặc định hệ thống). Số ca thực tế có thể thu thập: 102 (25 × 8 × 0,60 × 0,85). Kết luận khả thi: VÀNG — Sát ngưỡng (tỷ số 1,06). Khuyến cáo: cỡ mẫu sát ngưỡng. Nếu tỷ lệ đồng ý thấp hơn dự kiến, cân nhắc nới sai số cho phép lên 12% hoặc kéo dài thời gian thu thập thêm 1–2 tháng.",
    "references": "1. Tác giả A, Tác giả B, Tác giả C. [Tiêu đề bài báo tiếng Anh]. [Tên tạp chí viết tắt]. 2024;51(4):320-8. PMID: 00000001.\n2. Tác giả D, Tác giả E. [Tiêu đề bài báo tiếng Anh]. [Tên tạp chí viết tắt]. 2023;18(2):e0281234. DOI: 10.0000/journal.0281234.\n3. Tác giả F, Tác giả G, Tác giả H. [Tiêu đề bài báo tiếng Anh]. [Tên tạp chí viết tắt]. 2023;39(7):1102-11. PMID: 00000003.\n4. Tác giả I, Tác giả K. [Tiêu đề bài báo tiếng Việt]. Tạp chí Y học Việt Nam. 2022;515(1):45-9.\n5. Tác giả L, Tác giả M, Tác giả N. [Tiêu đề bài báo tiếng Anh]. [Tên tạp chí viết tắt]. 2021;102(11):2145-53. PMID: 00000005.",
    "questionsForAdvisor": "1. Ngưỡng sai số cho phép: nên giữ 10% hay nới lên 12% để bảo đảm đủ cỡ mẫu?\n2. Có nên bổ sung đánh giá tình trạng dinh dưỡng làm kết cục thứ hai không?\n3. Giai đoạn bán cấp nên giới hạn trong khoảng thời gian nào là phù hợp?",
    "advisorComments": ""
  }
}
