{
  "formatId": "journal-submission.default",
  "skeletonVersion": "v1",
  "projectId": "proj_phase5_atopic_dermatitis_ai",
  "note": "Real private content transcribed verbatim from the user's own uploaded Phase 5 reference document (IMRaD manuscript — Xây dựng ứng dụng chẩn đoán viêm da cơ địa dựa trên trí tuệ nhân tạo). Several passages in the source .docx itself end mid-sentence (verified: no tracked-changes/w:del markup in word/document.xml — the truncation is baked into the file's own <w:t> runs, not an extraction artifact). Per the engine's 'never invent a fact' discipline, those passages are preserved exactly as uploaded rather than completed. Kept entirely outside /formats; merged into formats/journal-submission/default/document-skeleton.json at export time by format-registry/answers-merge.ts — note the APPEND merge semantics documented on the skeleton's abstractVn/abstractEn slots.",
  "answers": {
    "title": "Xây dựng ứng dụng chẩn đoán viêm da cơ địa dựa trên trí tuệ nhân tạo\n(Development of a diagnostic application based on artificial intelligence for atopic dermatitis)",
    "authorBlock": "Tạ Lê Thanh Lam; Phạm Xuân Thế; Trần Duy Thịnh; Cao Niên Kỷ; Lê Hoàng Thiên Ân; Võ Hoàng Khải; Ngô Xuân Thiện; Nguyễn Đăng Khoa; Bùi Hải My; Phạm Lê Duy.\nTrường Y, Đại học Y Dược Thành Phố Hồ Chí Minh",
    "correspondingAuthorValue": "PGS.TS.BS. Phạm Lê Duy, Trường Y, Đại học Y Dược Thành phố Hồ Chí Minh, 217 Hồng Bàng, Phường Chợ Lớn, Thành phố Hồ Chí Minh, Việt Nam. Số điện thoại: +84-283-952-6028. Di động: +84-969-965-278. Email: drduypham@ump.edu.vn",
    "fundingValue": "Nghiên cứu này được tài trợ bởi Đại học Y Dược TP. Hồ Chí Minh. Đơn vị tài trợ không tham gia vào thiết kế nghiên cứu, thu thập dữ liệu, phân tích dữ liệu, diễn giải kết quả hoặc chuẩn bị bản thảo.",
    "abstractVn": "Viêm da cơ địa (VDCĐ) là [nội dung bản thảo gốc dừng ở đây]. (1) Xây dựng ứn[g dụng — bản thảo gốc dừng ở đây]. (2) Đánh giá hiệ[u năng — bản thảo gốc dừng ở đây]. Nghiên cứu gồm hai giai đoạn. Giai đoạn 1, xây dựng mô hình ConvNeXt V2 sử dụng 2.587 hình ảnh từ các ngân hàng dữ liệu y khoa. Giai đoạn 2, đán[h giá — bản thảo gốc dừng ở đây]. Ứng dụng AI dựa trê[n — bản thảo gốc dừng ở đây] cải thiện độ chính xác và tích hợp thêm dữ liệu lâm sàng để nâng cao hiệu quả ứng dụng.",
    "keywordsVn": "chẩn đoán, trí tuệ nhân tạo, ứng dụng, viêm da cơ địa.",
    "abstractEn": "Atopic dermatitis (AD) is a chronic inflammatory skin disorder for which no specific paraclinical dia[gnostic tool exists — source draft ends here]. (1) To develop an AI-based application for AD diagnosis using the ConvNeXt V2 model. (2) To e[valuate — source draft ends here]. The study was conducted in two phases. In Phase 1, a ConvNeXt V2 model was developed u[sing — source draft ends here]. Th[e results — source draft ends here]. The A[pplication — source draft ends here].",
    "keywordsEn": "application, artificial intelligence, diagnosis, atopic dermatitis.",
    "introductionBody": "Viêm da cơ địa (VDCĐ) là một bệnh lý viêm da mạn tính phổ biến trên toàn thế giới, tỷ lệ mắc bệnh VDCĐ trong đời là khoảng 15-30% ở trẻ em và 2-10% ở người lớn. [1,2] Khoảng 60% trường hợp sẽ phát triển trong năm đầu tiên của cuộc đời và 90% trước 5 tuổi. [3]",
    "objectives": "(1) Xây dựng ứng dụng chẩn đoán viêm da cơ địa dựa trên mô hình trí tuệ nhân tạo ConvNeXt V2.\n(2) Đánh giá hiệu năng chẩn đoán của ứng dụng so với chẩn đoán tham chiếu của bác sĩ lâm sàng trên dữ liệu thực tế.",
    "methodsBody": "Nghiên cứu của chúng tôi được chia thành 2 giai đoạn.\nGiai đoạn 1: Xây dựng ứng dụng. Đối tượng nghiên cứu và bộ dữ liệu: tổng cộng 2.587 hình ảnh được thu thập từ các ngân hàng dữ liệu y khoa. Quy trình nghiên cứu và mô hình sử dụng: mô hình ConvNeXt V2 được fine-tune, learning rate được giảm dần theo lịch tuyến tính (linear decay); các hình ảnh trùng lặp được loại trừ trước khi huấn luyện.\nGiai đoạn 2: Đánh giá hiệu năng chẩn đoán của ứng dụng so với chẩn đoán tham chiếu của bác sĩ lâm sàng. Đối tượng: bệnh nhân đến khám tại cơ sở y tế tham gia nghiên cứu. Thiết kế nghiên cứu: cắt ngang phân tích. Phương pháp và quy trình thực hiện: kết quả ghi nhận cuối cùng của chẩn đoán gồm 2 giá trị là có hoặc không có VDCĐ, nhằm nâng cao độ tin cậy của nhãn dữ liệu.\nPhân tích số liệu: đơn vị đầu vào của ứng dụng là từng hình ảnh lâm sàng riêng lẻ; mỗi hình ảnh được xử lý như một mẫu độc lập nhằm đánh giá khả năng phân loại tổn thương da của mô hình.",
    "resultsBody": "Giai đoạn 1: Xây dựng ứng dụng. Link video sử dụng trên lâm sàng: https://www.youtube.com/watch?v=a5SxQM6m14o. Link thử nghiệm ứng dụng: http://171.240.183.82:9099/. Lưu ý: do hạn chế về nguồn lực duy trì hệ thống, ứng dụng chỉ được mở trong thời gian giới hạn; yêu cầu truy cập gửi trước ít nhất 24 giờ qua địa chỉ phamxuanthe1504@gmail.com, thời gian mở hệ thống liên tục tối đa là 24 giờ.\nGiai đoạn 2: Đánh giá hiệu năng chẩn đoán của ứng dụng trên dữ liệu lâm sàng thực tế (Bảng 2: kết quả phân tích đường cong ROC của ứng dụng so với chẩn đoán tham chiếu của bác sĩ; Bảng 3: các giá trị chẩn đoán tại ngưỡng 78,6). Các giá trị nổi bật được quan sát bao gồm độ nhạy đạt 0,795 và độ đặc hiệu đạt 0,753.",
    "discussionBody": "Trong nghiên cứu này, chúng tôi đã xây dựng và kiểm định một ứng dụng chẩn đoán VDCĐ dựa trên mô hình ConvNeXt V2.\nSo sánh với các nghiên cứu tương tự (Bảng 1: các nghiên cứu về chẩn đoán viêm da cơ địa bằng AI).\nCác giới hạn chính và định hướng phát triển của nghiên cứu: cần cải thiện độ chính xác và tích hợp thêm dữ liệu lâm sàng để nâng cao hiệu quả ứng dụng trong các giai đoạn tiếp theo.",
    "conclusionBody": "VDCĐ là một bệnh lý viêm da mạn tính phổ biến. Ứng dụng AI dựa trên mô hình ConvNeXt V2 cho thấy tiềm năng hỗ trợ chẩn đoán, cần tiếp tục cải thiện độ chính xác và tích hợp thêm dữ liệu lâm sàng để nâng cao hiệu quả ứng dụng.",
    "acknowledgments": "Nhóm nghiên cứu xin cảm ơn Đại học Y Dược Thành phố Hồ Chí Minh đã tài trợ cho nghiên cứu này.",
    "references": "[1] A. Akan, E. Dibek-Mısırlıoğlu, E. Civelek, E. Vezir, and C. N. Kocabaş, \"Diagnosis of atopic dermatitis in children: comparison of the Hanifin-Rajka and the United Kingdom Working Party criteria,\" Allergol. Immunopathol. (Madr.), vol. 48, no. 2, pp. 175–181, Mar. 2020, doi: 10.1016/j.aller.2019.07.008.\n[2] P. P. Vakharia, R. Chopra, and J. I. Silverberg, \"Systematic Review of Diagnostic Criteria Used in Atopic Dermatitis Randomized Controlled Trials,\" Am. J. Clin. Dermatol., vol. 19, no. 1, pp. 15–22, Feb. 2018, doi: 10.1007/s40257-017-0299-4.\n[3] L. F. Eichenfield et al., \"Guidelines of care for the management of atopic dermatitis,\" J. Am. Acad. Dermatol., vol. 70, no. 2, pp. 338–351, Feb. 2014, doi: 10.1016/j.jaad.2013.10.010.\n[4] S. H. Nguyen et al., \"Health-Related Quality of Life Impairment among Patients with Different Skin Diseases in Vietnam: A Cross-Sectional Study,\" Int. J. Environ. Res. Public. Health, vol. 16, no. 3, p. 305, Jan. 2019, doi: 10.3390/ijerph16030305.\n[5] H. Wu et al., \"A deep learning, image based approach for automated diagnosis for inflammatory skin diseases,\" Ann. Transl. Med., vol. 8, no. 9, pp. 581–581, May 2020, doi: 10.21037/atm.2020.04.39.\n[6] A. Dautović et al., \"Diagnosis of Atopic dermatitis Using Artificial Neural Network,\" IFAC-Pap., vol. 55, no. 4, pp. 51–55, 2022, doi: 10.1016/j.ifacol.2022.06.008.\n[7] A. Maulana et al., \"Evaluation of atopic dermatitis severity using artificial intelligence,\" Narra J, vol. 3, no. 3, p. e511, Dec. 2023, doi: 10.52225/narra.v3i3.511.\n[8] R. Attar et al., \"Reliable Detection of Eczema Areas for Fully Automated Assessment of Eczema Severity from Digital Camera Images,\" JID Innov., vol. 3, no. 5, p. 100213, Sep. 2023, doi: 10.1016/j.xjidi.2023.100213.\n[9] P. Guimarães, A. Batista, M. Zieger, M. Kaatz, and K. Koenig, \"Artificial Intelligence in Multiphoton Tomography: Atopic Dermatitis Diagnosis,\" Sci. Rep., vol. 10, no. 1, p. 7968, May 2020, doi: 10.1038/s41598-020-64937-x."
  }
}
