{
  "formatId": "report-writing.default",
  "skeletonVersion": "v1",
  "projectId": "proj_phase4_ai_gait_analysis",
  "note": "Real private content transcribed from the user's own uploaded Phase 4 reference document (Báo cáo kết quả — so sánh phân tích dáng đi AI MediaPipe với hệ thống IMU sau đột quỵ), the completed-thesis counterpart of the Phase 2 protocol. Kept entirely outside /formats; merged into formats/report-writing/default/document-skeleton.json at export time by format-registry/answers-merge.ts.",
  "answers": {
    "problemStatementBody": "Do đó, việc tiến hành nghiên cứu nhằm mô tả các thông số dáng đi được phân tích bằng công cụ trí tuệ nhân tạo và đánh giá mức độ tương đồng giữa các thông số này với hệ thống phân tích dáng đi sử dụng cảm biến quán tính (IMU sensors) ở người bệnh sau đột quỵ là cần thiết. Kết quả nghiên cứu kỳ vọng sẽ góp phần làm rõ khả năng ứng dụng của các hệ thống markerless AI gait analysis trong cung cấp dữ liệu vận động định lượng khách quan, từ đó mở ra hướng tiếp cận đánh giá dáng đi đơn giản, chi phí thấp và phù hợp hơn với thực hành phục hồi chức năng lâm sàng.",
    "objectives": "Mục tiêu tổng quát: Đánh giá khả năng ứng dụng của hệ thống phân tích dáng đi dựa trên trí tuệ nhân tạo MediaPipe trong đánh giá dáng đi ở người bệnh sau đột quỵ thông qua so sánh với hệ thống phân tích dáng đi sử dụng cảm biến quán tính (IMU sensors).\nMục tiêu cụ thể:\n1. Mô tả đặc điểm lâm sàng và chức năng vận động của người bệnh sau đột quỵ tham gia nghiên cứu.\n2. Mô tả các thông số dáng đi được trích xuất từ video bằng hệ thống AI sử dụng MediaPipe.\n3. Mô tả các thông số dáng đi được ghi nhận bằng hệ thống phân tích dáng đi sử dụng cảm biến quán tính (IMU Sensors).\n4. Phân tích mức độ tương quan và độ tương đồng giữa các thông số dáng đi thu được từ MediaPipe và hệ thống IMU ở người bệnh sau đột quỵ.\n5. Xác định các thông số dáng đi có độ phù hợp cao giữa hai hệ thống nhằm đánh giá khả năng ứng dụng hệ thống AI MediaPipe trong thực hành phục hồi chức năng lâm sàng.",
    "literatureReviewBody": "1.1. Tổng quan về bất thường dáng đi sau đột quỵ\n1.1.1. Định nghĩa và đặc điểm bất thường dáng đi sau đột quỵ: Không phải tất cả bệnh nhân đều có cùng một kiểu dáng đi; điều này thường phụ thuộc vào mức độ nghiêm trọng, vị trí tổn thương và các yếu tố cá nhân. Loại bất thường dáng đi phổ biến nhất sau đột quỵ là dáng đi liệt nửa người (hemiplegic gait) [1,2].\n1.1.2. Cơ chế sinh lý bệnh bất thường dáng đi [2]: chủ yếu bắt nguồn từ tổn thương hệ thần kinh trung ương, dẫn đến sự kết hợp phức tạp giữa các thiếu hụt vận động nguyên phát và các cơ chế bù trừ thứ phát.\n1.2. Tổng quan về các phương pháp đánh giá dáng đi: có thể chia thành hai nhóm chính — truyền thống (dựa trên quan sát) và hiện đại (dựa trên công nghệ định lượng).\n1.2.1. Đánh giá lâm sàng: các thang điểm thường dùng gồm Functional Ambulation Category (FAC) [11], Wisconsin Gait Scale (WGS) [12], Time up and go (TUG) [13], Berg Balance Scale (BBS) [14], Modified Ashworth Scale (MAS) và thang điểm MRC [15].",
    "studyDesign": "Cắt ngang phân tích đánh giá tương đồng",
    "timeAndPlace": "Thời gian thực hiện: tháng 5/2026 – 5/2027 (12 tháng). Địa điểm nghiên cứu: Bệnh viện An Bình.",
    "subjects": "Dân số nghiên cứu: bệnh nhân đã được điều trị đột quỵ sau đợt cấp, có khả năng thực hiện nhiệm vụ đi bộ để ghi hình/phân tích dáng đi, đã đang hoặc sắp điều trị phục hồi chức năng sau đột quỵ.\nDân số chọn mẫu: các bệnh nhân sau đột quỵ đến khám hoặc điều trị tại Khoa Phục hồi chức năng Bệnh viện An Bình trong thời gian từ 01/07/2026 đến 01/07/2027, đáp ứng tiêu chí chọn mẫu và đồng ý tham gia nghiên cứu.\nTiêu chuẩn chọn vào: đã được chẩn đoán, điều trị đột quỵ và đã kết thúc giai đoạn cấp tính; có thể tự di chuyển và không cần hỗ trợ của người khác hoặc dụng cụ; đồng ý ghi hình và sử dụng dữ liệu cho nghiên cứu.\nTiêu chuẩn loại trừ: bệnh lý khác ảnh hưởng dáng đi rõ rệt (Parkinson, bệnh tiểu não, gãy xương chi dưới…); rối loạn về tâm thần không hợp tác.",
    "sampleSizeAndSampling": "Cỡ mẫu: được tính dựa trên mục tiêu phân tích mối tương quan giữa các thông số dáng đi thu được từ hệ thống markerless AI gait analysis MediaPipe và hệ thống IMU. Giả định hệ số tương quan kỳ vọng là 0,4, với mức ý nghĩa α = 0,05 và lực mẫu 80%, cỡ mẫu tối thiểu ước tính là 47 người bệnh. Dự phòng khoảng 10–15% trường hợp dữ liệu không đạt chất lượng, nghiên cứu dự kiến tuyển chọn khoảng 55–60 người bệnh sau đột quỵ.\nPhương pháp chọn mẫu: chọn mẫu thuận tiện liên tiếp, tuyển tất cả bệnh nhân sau đột quỵ đến khám/điều trị tại khoa Phục hồi chức năng bệnh viện An Bình trong thời gian thu thập số liệu, thỏa tiêu chí chọn vào và không thuộc tiêu chí loại trừ, cho đến khi đạt cỡ mẫu dự kiến.\nQuy trình lấy mẫu: (1) Sàng lọc bệnh nhân; (2) Mời tham gia nghiên cứu; (3) Tuyển mẫu và thu thập thông tin nền; (4) Ghi hình dáng đi theo quy trình chuẩn hóa; (5) Kiểm tra chất lượng dữ liệu; (6) Đánh giá bằng thiết bị Steadys (IMU sensors); (7) Ghép và xử lý dữ liệu.",
    "resultsBody": "3.1. Mục tiêu 1: Mô tả đặc điểm lâm sàng và chức năng vận động của người bệnh sau đột quỵ tham gia nghiên cứu (Bảng 3.1, Bảng 3.2). Nhận xét: tuổi trung bình của đối tượng nghiên cứu là 27,6 ± 4,9 tuổi, nhỏ nhất là 21 tuổi, lớn nhất là 41 tuổi. Nhóm tuổi 25-35 chiếm tỷ lệ cao nhất (75,0%). Tỷ lệ nam và nữ trong mẫu nghiên cứu tương đương nhau (mỗi giới 14/28 người, chiếm 50,0%).\n3.2. Mục tiêu 2: Mô tả các thông số dáng đi được trích xuất từ video bằng hệ thống AI sử dụng MediaPipe (Bảng 3.3). Nhận xét: thời gian ngồi trung bình của đối tượng nghiên cứu là 5,9 ± 1,8 giờ/ngày, thấp nhất là 2,0 giờ/ngày và cao nhất là 10,0 giờ/ngày. Phần lớn đối tượng ngồi từ 5–7 giờ/ngày, chiếm 57,1% (16 người); hai nhóm ngồi dưới 5 giờ/ngày và trên 7 giờ/ngày có tỷ lệ bằng nhau, mỗi nhóm chiếm 21,4% (6 người).",
    "discussionBody": "4.1. Đặc điểm dân số nghiên cứu\n4.1.1. Tuổi, giới tính: độ tuổi trung bình của đối tượng nghiên cứu là 27,6 ± 4,9 tuổi, người trẻ tuổi nhất là 21 tuổi và lớn tuổi nhất là 41 tuổi; nhóm tuổi 25–35 chiếm tỷ lệ cao nhất (75,0%). Đây là nhóm dân số trong độ tuổi lao động, phần lớn gắn với các công việc đòi hỏi tư thế ngồi kéo dài — một yếu tố đã được nhiều tác giả ghi nhận có liên quan đến tình trạng giảm độ mềm dẻo nhóm cơ ụ ngồi – cẳng chân [19, 20, 30]. Độ tuổi trung bình trong nghiên cứu này tương đồng với phần lớn các nghiên cứu can thiệp bằng kỹ thuật Muscle Energy (MET) trên người trẻ trưởng thành, vốn thường tuyển chọn đối tượng trong khoảng 18–35 tuổi [54, 55, 56].\n4.2. Kết quả so sánh: trước can thiệp, góc thiếu hụt duỗi gối chủ động (AKE) trung bình ở hai chân đều ở mức cao (chân phải 36,0 ± 6,4°; chân trái 36,8 ± 7,4°) và điểm nghiệm pháp Sit-and-Reach trung bình là 19,7 ± 7,0. Giá trị AKE nền cao, vượt xa ngưỡng chẩn đoán căng nhóm cơ ụ ngồi – cẳng chân thường được y văn áp dụng (thiếu hụt duỗi gối trên 15°) [2, 36]. Việc phối hợp đồng thời hai công cụ đo — AKE và Sit-and-Reach — giúp lượng giá độ mềm dẻo một cách toàn diện hơn, cả hai đều đã được chứng minh có độ tin cậy và giá trị tốt trong đánh giá độ mềm dẻo gân kheo [31, 33].",
    "references": "[1] S. Li, G. E. Francisco, and P. Zhou, \"Post-stroke Hemiplegic Gait: New Perspective and Insights,\" Front. Physiol., vol. 9, p. 1021, Aug. 2018, doi: 10.3389/fphys.2018.01021.\n[2] C. Beyaert, R. Vasa, and G. E. Frykberg, \"Gait post-stroke: Pathophysiology and rehabilitation strategies,\" Neurophysiol. Clin. Neurophysiol., vol. 45, no. 4–5, pp. 335–355, Nov. 2015, doi: 10.1016/j.neucli.2015.09.005.\n[3] N. T. H. Ân, H. Lý Cẩm, and N. Đặng Thị Thảo, \"Thực trạng sử dụng công cụ đo lường khả năng đi lại trên người bệnh đột quỵ trong điều trị vật lý trị liệu,\" Tạp Chí Khoa Học Trường Đại Học Quốc Tế Hồng Bàng, pp. 11–18, Sep. 2025, doi: 10.59294/HIUJS2025060.\n[19] N. Ben Chaabane et al., \"Quantitative gait analysis and prediction using artificial intelligence for patients with gait disorders,\" Sci. Rep., vol. 13, no. 1, p. 23099, Dec. 2023, doi: 10.1038/s41598-023-49883-8.\n[20] H. Chao, Y. He, J. Zhang, and J. Feng, \"GaitSet: Regarding Gait as a Set for Cross-View Gait Recognition,\" Proc. AAAI Conf. Artif. Intell., vol. 33, no. 01, pp. 8126–8133, Jul. 2019, doi: 10.1609/aaai.v33i01.33018126.\n[28] L. Guo et al., \"Wearable Intelligent Machine Learning Rehabilitation Assessment for Stroke Patients Compared with Clinician Assessment,\" J. Clin. Med., vol. 11, no. 24, p. 7467, Dec. 2022, doi: 10.3390/jcm11247467.\n[29] R. Jeter, R. Greenfield, S. N. Housley, and I. Belykh, \"Classifying Residual Stroke Severity Using Robotics-Assisted Stroke Rehabilitation: Machine Learning Approach,\" JMIR Biomed. Eng., vol. 9, p. e56980, Oct. 2024, doi: 10.2196/56980."
  }
}
